{
  "schemaVersion": "1.0",
  "id": "com.github.copilot.cloud-agent.model-selection-current",
  "slug": "model-selection-current",
  "subject": {
    "id": "com.github.copilot.cloud-agent",
    "name": "GitHub Copilot cloud agent",
    "publisher": "GitHub",
    "surface": { "kind": "hosted-service", "name": "GitHub Copilot cloud agent", "slug": "github-copilot-cloud-agent" }
  },
  "claim": {
    "category": "capability",
    "statement": "GitHub's current model guide says supported task entry points allow selection of Auto or a named model and, for supported models, a reasoning level, while entry points without a model picker use Auto automatically."
  },
  "provenance": { "kind": "publisher-declared", "claimant": "GitHub" },
  "source": {
    "uri": "https://docs.github.com/en/copilot/how-tos/use-copilot-agents/cloud-agent/changing-the-ai-model",
    "title": "Changing the AI model for GitHub Copilot cloud agent",
    "locator": "Introduction; model-picker availability note; Supported models; Reasoning level",
    "publishedAt": null,
    "capturedAt": "2026-07-31T22:45:15Z",
    "snapshot": null
  },
  "applicability": {
    "version": { "kind": "rolling-current", "value": null },
    "configuration": { "scope": "multiple", "values": ["Auto model selection", "named model at a supported entry point"] },
    "platform": { "scope": "multiple", "values": ["supported model-picker entry point", "entry point without model picker"] },
    "model": { "scope": "multiple", "values": ["Auto", "publisher-listed named model"] },
    "deployment": { "scope": "named", "values": ["Copilot cloud agent task"] }
  },
  "lifecycle": { "status": "active", "changedAt": "2026-08-01", "reason": null },
  "review": {
    "reviewedAt": "2026-08-01",
    "recheckAfter": "2026-10-30",
    "invalidatedBy": ["scheduled-recheck", "source-change", "source-unavailable", "claimant-correction", "product-surface-change", "configuration-change", "model-change", "manual-review"]
  },
  "limitations": [
    "The dossier intentionally does not freeze the current named-model list into the claim because it is rolling service documentation.",
    "No task, model route, reasoning level, fallback or output was observed."
  ],
  "unknowns": [
    "The selected model, provider revision, system configuration, reasoning level, routing and fallback behavior of a particular task are unknown.",
    "The relationship between the displayed model name and backend deployment identity is unknown."
  ],
  "relationships": [],
  "validationRefs": []
}
